{
  "id": "sierra",
  "name": "Sierra",
  "tagline": "336 villas on Maheshwaram Road",
  "status": "under-construction",
  "type": "villa",
  "zone": "south",
  "location": {
    "lat": 17.141191,
    "lng": 78.330714,
    "locality": "Maheshwaram Road",
    "precision": "exact"
  },
  "config": [
    "4 BHK"
  ],
  "sizes": {
    "builtUpSft": [
      3600
    ],
    "plotSqYd": [
      300
    ]
  },
  "scale": {
    "units": 336,
    "unitLabel": "villas",
    "acres": 36
  },
  "price": {
    "from": null,
    "to": null,
    "note": "Price on request"
  },
  "approvals": {
    "rera": "P02400011199",
    "authority": "HMDA"
  },
  "nearby": [
    "orr-15",
    "rgia",
    "statue-of-equality"
  ],
  "highlights": [
    "Clubhouse + auditorium",
    "Pickleball, tennis, cricket",
    "Walking track"
  ],
  "links": {
    "website": "https://www.subishisierra.com/",
    "video": "https://www.youtube.com/watch?v=dt1rzOKa-Gc",
    "videoIntro": "https://www.youtube.com/watch?v=Ng-yMH5HQ6E",
    "instagram": "https://www.instagram.com/subishigroup/"
  },
  "media": {
    "thumb": "/img/projects/sierra/thumb.webp",
    "hero": "/img/projects/sierra/hero.webp"
  },
  "published": true,
  "order": 3,
  "meta": {
    "lastVerified": "2026-10-22",
    "sources": [
      "https://www.subishisierra.com/"
    ],
    "todo": [
      "possession date (a listing site says ~Jun 2031)",
      "status: new launch or under construction"
    ]
  }
}
