{
  "id": "town-centre",
  "name": "Town Centre",
  "tagline": "Shops and homes on Mokila main road",
  "status": "delivered",
  "type": "mixed",
  "zone": "west",
  "location": {
    "lat": 17.424993,
    "lng": 78.206408,
    "locality": "Mokila main road",
    "precision": "exact"
  },
  "config": [
    "2 BHK"
  ],
  "sizes": {
    "builtUpSft": [
      1000
    ]
  },
  "scale": {
    "units": 75,
    "unitLabel": "flats",
    "acres": 2
  },
  "approvals": {},
  "nearby": [],
  "highlights": [
    "75,000+ sft commercial space"
  ],
  "links": {
    "website": "https://subishi.com/town-center-residential/",
    "websiteAlt": "https://subishi.com/town-center-commercial/"
  },
  "media": {
    "thumb": "/img/projects/town-centre/thumb.webp",
    "hero": "/img/projects/town-centre/hero.webp"
  },
  "published": true,
  "order": 200,
  "meta": {
    "lastVerified": "2026-10-22",
    "sources": [
      "https://subishi.com/town-center-residential/"
    ],
    "todo": [
      "completion year"
    ]
  }
}
